device_name,description
media_player.altavoces_exteriores_de_patio,Altavoces exteriores para patio
media_player.configuración_proyector_sótano,Sistema de proyector para sótano
media_player.altavoces_pc_de_oficina,Altavoces para ordenador de oficina
media_player.radio_reloj_alarma_de_cama,Radio despertador de cabecera
media_player.consola_sala_de_juegos,Consola de sala de juegos
media_player.sistema_salon_hi_fi,Audio de alta fidelidad para salón
media_player.comedor_sala_jukebox,Máquina de discos del comedor
media_player.huésped_habitación_tv_set,Televisión en la habitación de huéspedes
media_player.sala_de_estudio_audio_book_player,Reproductor de audiolibros para estudiar
media_player.reproductor_cd_sunroom,Reproductor de CD solarium
media_player.tocadiscos_vinilo_attico,Tocadiscos de vinilo para ático
media_player.proyector_exterior_patio_trasero,Proyector de patio trasero
media_player.asistente_de_voz_de_entrada,Asistente de voz de entrada
media_player.altavoz_pared_pasillo,Altavoz de pared para pasillo
switch.luces_del_ático,Interruptor de luces del ático
switch.iluminacion_balcon,Control de iluminación del balcón
switch.luces_sótano,Interruptor de luces del sótano
switch.ventilador_baño,Interruptor del ventilador del baño
switch.luces_dormitorio,Interruptor de luces del dormitorio
switch.luces_cobertizo_para_botes,Interruptor de luces del cobertizo para botes
switch.iluminación_armario,Control de iluminación del armario
switch.luces_invernadero,Interruptor de luces del invernadero
switch.luces_de_cubierta,Interruptor de iluminación de cubierta
switch.luces_den_lights,Interruptor de luces del estudio
switch.luces_del_comedor,Interruptor de luces del comedor
switch.luces_entrada,Control de iluminación de entrada
switch.iluminación_puerta_frontal,Interruptor de luces de puerta delantera
switch.luces_de_patio_frontal,Interruptor de luces del patio delantero
switch.abridor_de_puerta_de_garage,Interruptor de apertura de puerta de garaje
switch.luces_jardin,Control de iluminación del jardín
switch.luces_habitacion_huéspedes,Interruptor de luces de la habitación de invitados
switch.luces_pasillo,Interruptor de luces del pasillo
switch.iluminación_de_teatro_en_casa,Control de luces de cine en casa
switch.luces_cocina,Interruptor de luces de cocina
switch.luces_cuarto_lavandería,Interruptor de luces de lavandería
switch.luces_de_la_salon,Interruptor de luces de salón
switch.luces_loft,Interruptor de luces tipo loft
switch.luces_del_dormitorio_principal,Interruptor de luces del dormitorio principal
switch.luces_de_oficina,Interruptor de luces de oficina
switch.luces_de_seguridad_exteriores,Interruptor de luces de seguridad al aire libre
switch.luces_despensa,Interruptor de luces de despensa
switch.luces_patio,Interruptor de luces de patio
switch.luces_cuarto_de_juegos,Interruptor de luces de sala de juegos
switch.iluminación_area_piscina,Control de iluminación del área de la piscina.
switch.luces_porche,Interruptor de luces del porche
switch.luces_traseras_de_patio,Interruptor de luces del patio trasero
switch.luces_sauna,Interruptor de luces de sauna
switch.sistema_de_seguridad,interruptor del sistema de seguridad
switch.cobertizo_luces,Interruptor de luces de cobertizo
switch.luces_escalera,Interruptor de luces de escalera
switch.luces_sala_de_estudio,Interruptor de luces de sala de estudio
switch.luces_solárium,Interruptor de luces acristaladas
switch.iluminación_terraza,Control de iluminación de terraza
switch.luces_bajo_gabinete,Interruptor de luces debajo del gabinete
switch.luces_cuarto_utilidad,Interruptor de luces del lavadero
switch.luces_pasarela,Interruptor de luces de pasarela
switch.luces_almacén,Interruptor de luces de almacén
switch.luces_características_agua,Interruptor de luces de fuente de agua
switch.luces_taller,Interruptor de luces de taller
switch.reflectores_de_patio,Interruptor de reflectores de jardín
switch.iluminación_del_zoológico,Control de iluminación del recinto del zoológico
switch.bomba_piscina,Interruptor de bomba de piscina
switch.sistema_de_riego,Interruptor del sistema de riego
switch.luces_taller_garaje,Interruptor de luces de taller de garaje
climate.nido_aprendizaje,Termostato de aprendizaje Nest
climate.ecobee_smart,Termostato inteligente Ecobee
climate.honeywell_lyric_t6,Honeywell Letra T6 Pro
climate.emerson_sensi_touch,Termostato WiFi Emerson Sensi Touch
climate.bosch_bcc100,Control conectado Bosch BCC100
climate.johnson_glas,Termostato inteligente GLAS de Johnson Controls
climate.termostato_lux_geo,Termostato Wifi Lux Geo
climate.tado_inteligente,Termostato inteligente Tado
climate.trane_comfortlink_ii,Trane ComfortLink II XL1050
climate.transportista_cor,Termostato Wi-Fi Carrier Cor
climate.netatmo_smart,Termostato Inteligente Netatmo
climate.sinope_inteligente,Termostato inteligente Sinopé
climate.termostato_kono,Termostato inteligente Kono
climate.mysa_smart_thermostat,Termostato inteligente Mysa para calentadores eléctricos de zócalo
climate.termostato_zen_wifi,Termostato Zen Edición WiFi
vacuum.salón_roomba,aspiradora de salón
vacuum.kitchen_xiaomi,aspiradora de cocina
vacuum.arriba_dyson,Eliminador de polvo de arriba
vacuum.sótano_deebot,Deebot del sótano
vacuum.master_dormitorio_tiburón,aspiradora de dormitorio principal
vacuum.garaje_roomba_2,Robot de limpieza de garaje
vacuum.limpiador_bajo_sofa,Limpiador debajo del sofá
vacuum.comedor_area_bissel,Eliminador de suciedad del comedor
vacuum.pasillo_neato,Limpiador de caminos de pasillo
vacuum.entrada_eufy,Colector de polvo de entrada
vacuum.patio_puerta_vac,Limpiador de puertas de patio
vacuum.robot_esquina_izquierda,Succionador de suciedad de la esquina izquierda
vacuum.barredora_derecha_escalera,Limpiador de escaleras derecho
vacuum.arriba_baño_vac,Ayudante de baño de arriba
vacuum.habitación_de_invitados_abajo,Aspiradora de la habitación de invitados de la planta baja
vacuum.automatizador_doméstico_inteligente,Robot de limpieza del hogar inteligente
vacuum.robot_arriba_escaleras,Dispositivo para quitar el polvo encima de las escaleras
vacuum.limpiador_bajo_cama,Colector de polvo debajo de la cama
vacuum.frente_hall_samsung,Robot de barrido del vestíbulo
vacuum.barredora_de_cubierta_trasera,Limpiador de zona de terraza trasera
todo.lista_de_tareas_diarias,Rastreador de tareas diarias
todo.lista_de_compras_de_comestibles,Organizador de compras de comestibles
todo.proyectos_fin_de_semana,Lista de proyectos de bricolaje del fin de semana
todo.planificador_de_eventos_familiar,Planificador de eventos familiares
todo.rastreador_de_rutina_de_entrenamiento,Programador de rutinas de entrenamiento
todo.plazos_de_trabajo_para_niños,Plazos para las tareas de los niños
todo.calendario_vacunación_mascota,Calendario de vacunación de mascotas
todo.registro_mantenimiento_automóvil,Rastreador de mantenimiento del coche
todo.lista_recordatorio_cumpleaños,Lista de recordatorios de cumpleaños
todo.planificador_aniversario,Planificador de eventos de aniversario
todo.planificación_vacaciones,Asistente de planificación de vacaciones
todo.lista_lectura_libro,Organizador de lista de lectura
todo.lista_de_observación_de_películas,Lista de vigilancia nocturna de cine
todo.colección_recetas,Colección de recetas
todo.planificador_de_renovación_del_hogar,Programador de renovación del hogar
todo.horario_cuidado_del_jardin,Planificador de cuidados del jardín
todo.recordatorios_pago_factura,Recordatorios de pago de facturas
todo.alertas_renovación_seguros,Alertas de renovación de seguros
todo.gestión_de_suscripciones,Herramienta de gestión de suscripciones
todo.rastreador_garantía,Rastreador de vencimiento de garantía
timer.cocina_horno,Temporizador de horno de cocina
timer.lavadora_maquina_1,Rastreador de ciclo de lavandería
timer.riego_jardin,Programador de riego de jardín
timer.luces_porche_frontal,Temporizador de luz del porche delantero
timer.reflectores_patio_trasero,Controlador de iluminación para patio trasero
timer.puerta_garaje_1,Temporizador de puerta de garaje
timer.temporizador_lámpara_dormitorio,Programador de lámparas de dormitorio
timer.atenuador_comedor,Temporizador de luz del comedor
timer.pasillo_arriba,Temporizador del pasillo de arriba
timer.luz_del_armario_de_abajo,Temporizador del armario de abajo
timer.entrada_candelabro,Temporizador de lámpara de entrada
timer.iluminación_patio,Temporizador de ambiente de patio
timer.luces_de_seguridad_de_entrada,Temporizador de seguridad en la entrada
timer.luz_nocturna_habitacion_niños,Temporizador de luz nocturna para habitación de niños
timer.temporizador0,Temporizador de uso general
timer.temporizador7,Temporizador personalizado 7
timer.mi_temporizador,Temporizador personalizado
timer.temporizador_de_cocina,Cuenta regresiva de la cocina
timer.cuenta_regresiva_de_lavandería,Temporizador de ciclo de lavado
timer.alarma_matutina,Alarma para despertarse por la mañana
timer.temporizador_entrenamiento,Temporizador de sesión de ejercicio
timer.sesión_de_estudio,Temporizador de enfoque de estudio
timer.reloj_meditacion,Rastreador de duración de la meditación
timer.temporizador_siesta_bebe,Monitor de siesta para bebés
timer.té_empapado,Cuenta regresiva para preparar el té
timer.temporizador_juego,Temporizador de juego de mesa
timer.cafe_mañanero,Temporizador de preparación de café por la mañana
